{
  "contract_name": "SIMS_DOCTOR_EXPLANATION_V1",
  "contract_version": "1.0",
  "explanation_id": "EXP-20260804-062319-1BB964",
  "case_id": "CASE-1",
  "medical_record_id": "MR-1",
  "created_at": "2026-08-04T06:23:19.285005+00:00",
  "audience": "USER",
  "final_diagnosis": "LOCAL_OPTIMIZATION",
  "summary": "LOCAL_OPTIMIZATIONと判断し、SIMS_WRITERへの紹介を選択しました。",
  "decision_path": [
    {
      "step": "DATA_SUFFICIENCY",
      "status": "PASSED",
      "message": "診断に必要なデータ量を確認しました。"
    },
    {
      "step": "RECENT_CHANGE",
      "status": "PASSED",
      "message": "直近変更による観察待ちはありません。"
    },
    {
      "step": "WINNER_QUERY",
      "status": "PASSED",
      "message": "Winner Query保護による制限はありません。"
    },
    {
      "step": "MERGE",
      "status": "PASSED",
      "message": "Merge優先条件はありません。"
    },
    {
      "step": "FINAL_DIAGNOSIS",
      "status": "SELECTED",
      "message": "最終診断としてLOCAL_OPTIMIZATIONを選択しました。"
    }
  ],
  "supporting_factors": [
    {
      "assessment_type": "ctr_opportunity_assessments",
      "classification": "HIGH_CTR_OPPORTUNITY",
      "confidence": 94,
      "severity": "SEVERE"
    }
  ],
  "blocking_factors": [],
  "trace": {
    "composite_diagnosis_id": "CDX-1",
    "treatment_recommendation_id": "TRX-1"
  }
}
